{"asof":"2026-10-12","bounds":{"max":[0.6,0.6,0.6,0.6,0.6],"min":[0.0,0.0,0.0,0.0,0.0],"requested":[{"max":null,"min":null},{"max":null,"min":null},{"max":null,"min":null},{"max":null,"min":null},{"max":null,"min":null}],"rule":"max(0.25, 3/N)"},"build_seconds":16.275,"built_at":"2026-10-17T03:58:54Z","cov":[[2.587628665198194e-05,0.00016678701759046717,-2.9840783396580247e-05,-1.9002874707871864e-05,-2.206536127355337e-05],[0.00016678701759046717,0.002166593659496138,-0.0001270322815665293,-0.0001288018508728427,-0.00013786639285462695],[-2.9840783396580247e-05,-0.0001270322815665293,0.025450576194232338,0.028740140944974076,0.021347842231762816],[-1.9002874707871864e-05,-0.0001288018508728427,0.028740140944974076,0.03712734704503882,0.02442605065035359],[-2.206536127355337e-05,-0.00013786639285462695,0.021347842231762816,0.02442605065035359,0.022896526095870277]],"enb_ref":4.501612055103218,"engine_version":"0.2.0","entered":{"range":{"bad":-0.07386560184055171,"good":0.24531870712233628,"normal":{"high":0.2058304026605098,"low":-0.07907111954514603,"mid":0.06337964155768189},"typical":0.05591282061823105},"set_aside":0.0,"w":[0.21035150844173817,0.3454193191253806,0.3000276778300581,0.07500691945751453,0.0691945751453086]},"frontier":{"range":{"bad":[-0.0036189407801848887,-0.03957187364190482,-0.0860898733558543,-0.12962754898893072,-0.17220501442488934,-0.2140240675932769],"good":[0.06884492338799522,0.18177640735270126,0.2862960025876946,0.39285750613809833,0.506684771264027,0.6391378272981187],"normal":{"high":[0.07072985108357799,0.15863919663520412,0.23766819643262455,0.31509664298669693,0.3925156570977687,0.4680134451250202],"low":[-0.006981741994898483,-0.04208575894893543,-0.08607012120617565,-0.13165503714301027,-0.1772493852140944,-0.2247649595217286],"mid":[0.03187405454433975,0.058276718843134345,0.07579903761322444,0.09172080292184334,0.10763313594183717,0.12162424280164581]},"typical":[0.031111143267937118,0.053587896489438014,0.0667870203367638,0.0771060130532778,0.08703001213956764,0.09133114498349701]},"s_safe":0.0,"w":[[0.599999993382117,0.3584409855588041,0.011526935095598923,4.2356490632092675e-08,0.03003204360698947],[0.5999999981635917,0.09478262296301994,4.910384815476602e-08,0.16461305206115268,0.14060427770838735],[0.52971598511407,1.252997263218039e-08,4.043462178896277e-08,0.33762345115454934,0.13266051076678612],[0.351183770511284,2.822925303308951e-09,6.166539796724552e-09,0.4663954284499709,0.1824207920492799],[0.17279618840574365,2.239265880727205e-09,9.788510726996651e-09,0.5951886530712976,0.23201514649518207],[0.0,0.0,0.4,0.6,0.0]],"x":[0.01982438598940726,0.051205345763298715,0.08258630553719017,0.11396726531108162,0.14534822508497305,0.1767291848588645],"y":[0.031874054544339746,0.058276718843134345,0.07579903761322444,0.09172080292184336,0.10763313594183717,0.12162424280164581]},"frontier_curve":{"mu":[0.031874054544339746,0.03517438758168907,0.0384747206190384,0.04177505365638772,0.04507538669373705,0.04837571973108637,0.05167605276843569,0.05497638580578502,0.058276718843134345,0.060467008689395606,0.06265729853565687,0.06484758838191813,0.06703787822817939,0.06922816807444065,0.07141845792070192,0.07360874776696319,0.07579903761322444,0.0777892582768018,0.07977947894037918,0.08176969960395654,0.0837599202675339,0.08575014093111127,0.08774036159468862,0.089730582258266,0.09172080292184336,0.09370984454934259,0.09569888617684182,0.09768792780434103,0.09967696943184025,0.10166601105933948,0.10365505268683871,0.10564409431433794,0.10763313594183717,0.10938202429931325,0.11113091265678933,0.11287980101426542,0.11462868937174149,0.11637757772921757,0.11812646608669365,0.11987535444416976,0.12162424280164581],"sigma":[0.01982438598940726,0.020802377535329573,0.023253512251326484,0.026776240261799755,0.03100745946909372,0.03569611088805309,0.04068435094691451,0.045874554832129474,0.0512053458122805,0.055041467747497595,0.058912099736733385,0.06281086220178199,0.06673282488565943,0.07067412550189318,0.0746317004043391,0.07860309145687036,0.08258630552010209,0.0865072158988316,0.0904287418443512,0.09435080660182711,0.0982733456597275,0.10219630440370633,0.10611963628976284,0.11004330140742748,0.11396726533921103,0.11788917343485104,0.12181132421821042,0.1257336949780086,0.1296562657500175,0.13357901891405982,0.13750193885990727,0.14142501170872124,0.1453482250795569,0.1491177869812932,0.15293771590481237,0.15680433090232493,0.16071426235661998,0.16466442466878234,0.168651991004351,0.17267437007131145,0.1767291848588645]},"frontier_uncapped":{"mu":[0.034065254303957924,0.055462670958814825,0.07454635323522815,0.09358383200216479,0.11260869850886654,0.1307787957654773],"sigma":[0.005074882623101417,0.04259682192994789,0.08011876123679436,0.11764070054364083,0.15516263985048728,0.19268457915733375]},"generation":"2026-10-12-0.2.0","grid":{"k_div":[-1,0,1,2,3,-1],"w":[[[0.599999993382117,0.3584409855588041,0.011526935095598923,4.2356490632092675e-08,0.03003204360698947],null,null,null,null],[[0.13051647328341004,0.5999999999999999,0.10705253885275712,0.07567176834764659,0.08675921951618665],[0.4040855385116955,0.2962966007254735,0.07251111866099334,0.12366541210643933,0.1034413299953986],null,null,null],[[3.7470027081099033e-16,0.513392627751032,0.1773314677952755,0.17715388316842454,0.13212202128526768],[3.7470027081099033e-16,0.513392627751032,0.1773314677952755,0.17715388316842454,0.13212202128526768],null,null,null],[[3.831310269042376e-14,0.3007232576518991,0.2738182276486312,0.2299360014750901,0.19552251322434133],[3.831310269042376e-14,0.3007232576518991,0.2738182276486312,0.2299360014750901,0.19552251322434133],[3.831310269042376e-14,0.3007232576518991,0.2738182276486312,0.2299360014750901,0.19552251322434133],null,null],[[-9.367506770274758e-17,0.09114343842389627,0.39201120581634796,0.24296923629619846,0.2738761194635575],[-9.367506770274758e-17,0.09114343842389627,0.39201120581634796,0.24296923629619846,0.2738761194635575],[-9.367506770274758e-17,0.09114343842389627,0.39201120581634796,0.24296923629619846,0.2738761194635575],[-9.367506770274758e-17,0.09114343842389627,0.39201120581634796,0.24296923629619846,0.2738761194635575],null],[[0.0,0.0,0.4,0.6,0.0],[0.0,0.0,0.4,0.6,0.0],[0.0,0.0,0.4,0.6,0.0],[0.0,0.0,0.4,0.6,0.0],[0.0,0.0,0.4,0.6,0.0]]],"w_div":[[0.599999993382117,0.3584409855588041,0.011526935095598923,4.2356490632092675e-08,0.03003204360698947],[0.13051647328341004,0.5999999999999999,0.10705253885275712,0.07567176834764659,0.08675921951618665],[3.7470027081099033e-16,0.513392627751032,0.1773314677952755,0.17715388316842454,0.13212202128526768],[3.831310269042376e-14,0.3007232576518991,0.2738182276486312,0.2299360014750901,0.19552251322434133],[-9.367506770274758e-17,0.09114343842389627,0.39201120581634796,0.24296923629619846,0.2738761194635575],[0.0,0.0,0.4,0.6,0.0]],"y":[0.031874054544339746,0.054311601608666264,0.07674914867299279,0.09918669573731931,0.12162424280164581],"y_div":[0.031874054544339746,0.031874054544339746,0.054311601608666264,0.07674914867299279,0.09918669573731931,0.12162424280164581],"y_sug":[0.031874054544339746,0.05256773348850696,0.07340699362390171,0.09024521971857127,0.10676344962592997,0.12162424280164581],"z":[[2.4418185847508047,null,null,null,null],[4.501612055103218,3.7770961212511396,null,null,null],[3.717136955704433,3.717136955704433,null,null,null],[3.1746023244354813,3.1746023244354813,3.1746023244354813,null,null],[3.010511414916163,3.010511414916163,3.010511414916163,3.010511414916163,null],[2.817449995699527,2.817449995699527,2.817449995699527,2.817449995699527,2.817449995699527]]},"ladder":{"collapsed":[true,false,false,false,false,true],"default_point":"balanced","hop":[[false,false,false,false],[false,false,false,false],[false,false,false,false],[false,false,false,false],[false,false,false,false],[false,false,false,false]],"range":{"bad":[[-0.0036189407801848887,-0.0036189407801848887,-0.0036189407801848887,-0.0036189407801848887,-0.0036189407801848887],[-0.03957187364190482,-0.041121559085593035,-0.040934342853583924,-0.04181914963821371,-0.04260461593522996],[-0.0860898733558543,-0.08556764050148663,-0.08553104913288187,-0.08550264146632237,-0.08858439559775542],[-0.12962754898893072,-0.1283214595594425,-0.12804532382932174,-0.12966084510267045,-0.1294974466039191],[-0.17220501442488934,-0.17205625625074258,-0.17051468626065602,-0.17114774172149272,-0.17219735361099545],[-0.2140240675932769,-0.2140240675932769,-0.2140240675932769,-0.2140240675932769,-0.2140240675932769]],"good":[[0.06884492338799522,0.06884492338799522,0.06884492338799522,0.06884492338799522,0.06884492338799522],[0.18177640735270126,0.1764690507983772,0.16955966627821328,0.1634800701151073,0.15817913613509335],[0.2862960025876946,0.28266189060660674,0.27836595948062565,0.272327570426738,0.26820187395312556],[0.39285750613809833,0.3967242202394274,0.3934323707488679,0.3899116260202621,0.3889517598080276],[0.506684771264027,0.5110115249000521,0.5097113025690618,0.5126009286977615,0.5158605965536098],[0.6391378272981187,0.6391378272981187,0.6391378272981187,0.6391378272981187,0.6391378272981187]],"normal":{"high":[[0.07072985108357799,0.07072985108357799,0.07072985108357799,0.07072985108357799,0.07072985108357799],[0.15863919663520412,0.15578470390650964,0.1529302112331159,0.150075718508059,0.1472212258299463],[0.23766819643262455,0.23527615248543324,0.23288410852252142,0.23049206449879234,0.22810002050930575],[0.31509664298669693,0.31362105972847937,0.3121454765415183,0.3106698933733321,0.30919431011895854],[0.3925156570977687,0.391645970792508,0.39077628451777785,0.3901376841635663,0.3890369118465622],[0.4680134451250202,0.4680134451250202,0.4680134451250202,0.4680134451250202,0.4680134451250202]],"low":[[-0.006981741994898483,-0.006981741994898483,-0.006981741994898483,-0.006981741994898483,-0.006981741994898483],[-0.04208575894893543,-0.04494025157486833,-0.04779474425610197,-0.05064923688567245,-0.053503729562187144],[-0.08607012120617565,-0.0884621